<?xml version="1.0" encoding="UTF-8"?>
<xs:schema xmlns:xs="http://www.w3.org/2001/XMLSchema" elementFormDefault="qualified">
  <xs:element name="content">
    <xs:complexType>
      <xs:sequence>
        <xs:element ref="description"/>
      </xs:sequence>
    </xs:complexType>
  </xs:element>
  <xs:element name="description">
    <xs:complexType>
      <xs:sequence>
        <xs:element ref="levelledPara"/>
      </xs:sequence>
    </xs:complexType>
  </xs:element>
  <xs:element name="levelledPara">
    <xs:complexType>
      <xs:choice minOccurs="0" maxOccurs="unbounded">
        <xs:element ref="levelledPara"/>
        <xs:element ref="para"/>
        <xs:element ref="title"/>
      </xs:choice>
      <xs:attribute name="id" use="required" type="xs:NCName"/>
    </xs:complexType>
  </xs:element>
  <xs:element name="title" type="xs:string"/>
  <xs:element name="para">
    <xs:complexType mixed="true">
      <xs:choice minOccurs="0" maxOccurs="unbounded">
        <xs:element ref="emphasis"/>
        <xs:element ref="randomList"/>
      </xs:choice>
    </xs:complexType>
  </xs:element>
  <xs:element name="emphasis">
    <xs:complexType mixed="true">
      <xs:attribute name="emphasisType" use="required" type="xs:NCName"/>
    </xs:complexType>
  </xs:element>
  <xs:element name="randomList">
    <xs:complexType>
      <xs:sequence>
        <xs:element maxOccurs="unbounded" ref="listItem"/>
      </xs:sequence>
      <xs:attribute name="listItemPrefix" use="required" type="xs:NCName"/>
    </xs:complexType>
  </xs:element>
  <xs:element name="listItem">
    <xs:complexType>
      <xs:sequence>
        <xs:element ref="para"/>
      </xs:sequence>
    </xs:complexType>
  </xs:element>
</xs:schema>
